{
  "version": "0.3",
  "generated_at": "2026-08-20T14:12:29+00:00",
  "areas": [
    {
      "slug": "busan",
      "label": "부산",
      "parent": null,
      "case_count": 0
    },
    {
      "slug": "busan-buk",
      "label": "부산 북구",
      "parent": "busan",
      "case_count": 0
    },
    {
      "slug": "busan-nam",
      "label": "부산 남구",
      "parent": "busan",
      "case_count": 0
    },
    {
      "slug": "gimhae",
      "label": "김해",
      "parent": null,
      "case_count": 0
    },
    {
      "slug": "yangsan",
      "label": "양산",
      "parent": null,
      "case_count": 0
    },
    {
      "slug": "gangnam",
      "label": "서울 강남구",
      "parent": null,
      "case_count": 0
    },
    {
      "slug": "seocho",
      "label": "서울 서초구",
      "parent": null,
      "case_count": 0
    },
    {
      "slug": "pyeongtaek",
      "label": "평택",
      "parent": null,
      "case_count": 0
    }
  ],
  "nodes": [
    {
      "id": "common.compare_partial_vs_full",
      "parent_id": null,
      "level": 2,
      "label": "부분수리 vs 전체교체",
      "query_ko": "부분수리와 전체교체 차이",
      "aliases": [
        "부분수리 vs 전체교체"
      ],
      "intent": [
        "compare"
      ],
      "suggested_ct": "CT4",
      "suggested_page_type": "WIKI",
      "area_expandable": false,
      "volume_hint": "high",
      "competition_hint": "low",
      "evidence_case_ids": [],
      "priority_score": 67.0,
      "status": "OPEN",
      "hold_reason": null,
      "target_page_id": null,
      "target_url": "/wiki/partial-vs-full",
      "merged_into": null,
      "dedupe_key": "3b1a7a20a40a3bd9",
      "notes": ""
    },
    {
      "id": "entrance.firedoor.sag#judge",
      "parent_id": "entrance.firedoor.sag",
      "level": 4,
      "label": "방화문·현관문 처짐·바닥 끌림 · 수리·교체 판단",
      "query_ko": "방화문·현관문 처짐·바닥 끌림 수리 가능한가",
      "aliases": [],
      "intent": [
        "judge"
      ],
      "suggested_ct": "CT5",
      "suggested_page_type": "LANDING",
      "area_expandable": true,
      "volume_hint": "high",
      "competition_hint": "low",
      "evidence_case_ids": [],
      "priority_score": 67.0,
      "status": "OPEN",
      "hold_reason": null,
      "target_page_id": null,
      "target_url": "/repair/entrance-firedoor-sag-judge",
      "merged_into": null,
      "dedupe_key": "6e65e70a1cbabf0b",
      "notes": ""
    },
    {
      "id": "entrance.temperedglass.floorhinge#judge",
      "parent_id": "entrance.temperedglass.floorhinge",
      "level": 4,
      "label": "강화도어·유리문 플로어힌지 유압 파손 · 수리·교체 판단",
      "query_ko": "강화도어·유리문 플로어힌지 유압 파손 수리 가능한가",
      "aliases": [],
      "intent": [
        "judge"
      ],
      "suggested_ct": "CT5",
      "suggested_page_type": "LANDING",
      "area_expandable": true,
      "volume_hint": "high",
      "competition_hint": "low",
      "evidence_case_ids": [],
      "priority_score": 67.0,
      "status": "OPEN",
      "hold_reason": null,
      "target_page_id": null,
      "target_url": "/repair/entrance-temperedglass-floorhinge-judge",
      "merged_into": null,
      "dedupe_key": "eaf326b5c7722bac",
      "notes": ""
    },
    {
      "id": "entrance.firedoor.sag#cause",
      "parent_id": "entrance.firedoor.sag",
      "level": 4,
      "label": "방화문·현관문 처짐·바닥 끌림 · 원인",
      "query_ko": "방화문·현관문 처짐·바닥 끌림 원인",
      "aliases": [],
      "intent": [
        "cause"
      ],
      "suggested_ct": "CT1",
      "suggested_page_type": "LANDING",
      "area_expandable": false,
      "volume_hint": "high",
      "competition_hint": "low",
      "evidence_case_ids": [],
      "priority_score": 64.6,
      "status": "OPEN",
      "hold_reason": null,
      "target_page_id": null,
      "target_url": "/repair/entrance-firedoor-sag-cause",
      "merged_into": null,
      "dedupe_key": "baa168d6dd4b4d71",
      "notes": ""
    },
    {
      "id": "entrance.temperedglass.floorhinge#cause",
      "parent_id": "entrance.temperedglass.floorhinge",
      "level": 4,
      "label": "강화도어·유리문 플로어힌지 유압 파손 · 원인",
      "query_ko": "강화도어·유리문 플로어힌지 유압 파손 원인",
      "aliases": [],
      "intent": [
        "cause"
      ],
      "suggested_ct": "CT1",
      "suggested_page_type": "LANDING",
      "area_expandable": false,
      "volume_hint": "high",
      "competition_hint": "low",
      "evidence_case_ids": [],
      "priority_score": 64.6,
      "status": "OPEN",
      "hold_reason": null,
      "target_page_id": null,
      "target_url": "/repair/entrance-temperedglass-floorhinge-cause",
      "merged_into": null,
      "dedupe_key": "efeb73ad669e0dd2",
      "notes": ""
    },
    {
      "id": "entrance.firedoor.sag#cost",
      "parent_id": "entrance.firedoor.sag",
      "level": 4,
      "label": "방화문·현관문 처짐·바닥 끌림 · 비용 요소",
      "query_ko": "방화문·현관문 처짐·바닥 끌림 비용이 달라지는 이유",
      "aliases": [],
      "intent": [
        "cost"
      ],
      "suggested_ct": "CT5",
      "suggested_page_type": "LANDING",
      "area_expandable": false,
      "volume_hint": "high",
      "competition_hint": "low",
      "evidence_case_ids": [],
      "priority_score": 64.0,
      "status": "HOLD",
      "hold_reason": "비용 근거 없음 — M14는 '달라지는 이유'만 작성 가능",
      "target_page_id": null,
      "target_url": "/repair/entrance-firedoor-sag-cost",
      "merged_into": null,
      "dedupe_key": "17674ac177b89c90",
      "notes": ""
    },
    {
      "id": "entrance.temperedglass.floorhinge#cost",
      "parent_id": "entrance.temperedglass.floorhinge",
      "level": 4,
      "label": "강화도어·유리문 플로어힌지 유압 파손 · 비용 요소",
      "query_ko": "강화도어·유리문 플로어힌지 유압 파손 비용이 달라지는 이유",
      "aliases": [],
      "intent": [
        "cost"
      ],
      "suggested_ct": "CT5",
      "suggested_page_type": "LANDING",
      "area_expandable": false,
      "volume_hint": "high",
      "competition_hint": "low",
      "evidence_case_ids": [],
      "priority_score": 64.0,
      "status": "HOLD",
      "hold_reason": "비용 근거 없음 — M14는 '달라지는 이유'만 작성 가능",
      "target_page_id": null,
      "target_url": "/repair/entrance-temperedglass-floorhinge-cost",
      "merged_into": null,
      "dedupe_key": "818f49a773c5dd4b",
      "notes": ""
    },
    {
      "id": "entrance.firedoor#area_busan",
      "parent_id": "entrance.firedoor",
      "level": 4,
      "label": "부산 방화문·현관문 수리",
      "query_ko": "부산 방화문·현관문 수리",
      "aliases": [],
      "intent": [
        "area"
      ],
      "suggested_ct": "CT6",
      "suggested_page_type": "AREA",
      "area_expandable": true,
      "volume_hint": "high",
      "competition_hint": "low",
      "evidence_case_ids": [],
      "priority_score": 63.4,
      "status": "HOLD",
      "hold_reason": "부산 실제 CASE 없음 (사실성 규칙 F1)",
      "target_page_id": null,
      "target_url": "/area/busan/firedoor",
      "merged_into": null,
      "dedupe_key": "c5c114ba13ad99f6",
      "notes": ""
    },
    {
      "id": "entrance.firedoor#area_busan_buk",
      "parent_id": "entrance.firedoor",
      "level": 4,
      "label": "부산 북구 방화문·현관문 수리",
      "query_ko": "부산 북구 방화문·현관문 수리",
      "aliases": [],
      "intent": [
        "area"
      ],
      "suggested_ct": "CT6",
      "suggested_page_type": "AREA",
      "area_expandable": true,
      "volume_hint": "high",
      "competition_hint": "low",
      "evidence_case_ids": [],
      "priority_score": 63.4,
      "status": "HOLD",
      "hold_reason": "부산 북구 실제 CASE 없음 (사실성 규칙 F1)",
      "target_page_id": null,
      "target_url": "/area/busan-buk/firedoor",
      "merged_into": null,
      "dedupe_key": "59f9f92e82c3713b",
      "notes": ""
    },
    {
      "id": "entrance.firedoor#area_busan_nam",
      "parent_id": "entrance.firedoor",
      "level": 4,
      "label": "부산 남구 방화문·현관문 수리",
      "query_ko": "부산 남구 방화문·현관문 수리",
      "aliases": [],
      "intent": [
        "area"
      ],
      "suggested_ct": "CT6",
      "suggested_page_type": "AREA",
      "area_expandable": true,
      "volume_hint": "high",
      "competition_hint": "low",
      "evidence_case_ids": [],
      "priority_score": 63.4,
      "status": "HOLD",
      "hold_reason": "부산 남구 실제 CASE 없음 (사실성 규칙 F1)",
      "target_page_id": null,
      "target_url": "/area/busan-nam/firedoor",
      "merged_into": null,
      "dedupe_key": "60bf2d18d2ae1b0a",
      "notes": ""
    },
    {
      "id": "entrance.firedoor#area_gangnam",
      "parent_id": "entrance.firedoor",
      "level": 4,
      "label": "서울 강남구 방화문·현관문 수리",
      "query_ko": "서울 강남구 방화문·현관문 수리",
      "aliases": [],
      "intent": [
        "area"
      ],
      "suggested_ct": "CT6",
      "suggested_page_type": "AREA",
      "area_expandable": true,
      "volume_hint": "high",
      "competition_hint": "low",
      "evidence_case_ids": [],
      "priority_score": 63.4,
      "status": "HOLD",
      "hold_reason": "서울 강남구 실제 CASE 없음 (사실성 규칙 F1)",
      "target_page_id": null,
      "target_url": "/area/gangnam/firedoor",
      "merged_into": null,
      "dedupe_key": "ae347a245b29b563",
      "notes": ""
    },
    {
      "id": "entrance.firedoor#area_gimhae",
      "parent_id": "entrance.firedoor",
      "level": 4,
      "label": "김해 방화문·현관문 수리",
      "query_ko": "김해 방화문·현관문 수리",
      "aliases": [],
      "intent": [
        "area"
      ],
      "suggested_ct": "CT6",
      "suggested_page_type": "AREA",
      "area_expandable": true,
      "volume_hint": "high",
      "competition_hint": "low",
      "evidence_case_ids": [],
      "priority_score": 63.4,
      "status": "HOLD",
      "hold_reason": "김해 실제 CASE 없음 (사실성 규칙 F1)",
      "target_page_id": null,
      "target_url": "/area/gimhae/firedoor",
      "merged_into": null,
      "dedupe_key": "12acfcaf53895758",
      "notes": ""
    },
    {
      "id": "entrance.firedoor#area_pyeongtaek",
      "parent_id": "entrance.firedoor",
      "level": 4,
      "label": "평택 방화문·현관문 수리",
      "query_ko": "평택 방화문·현관문 수리",
      "aliases": [],
      "intent": [
        "area"
      ],
      "suggested_ct": "CT6",
      "suggested_page_type": "AREA",